<?xml version="1.0" encoding="UTF-8"?>
<dev:device
	xmlns:xsi="http://www.w3.org/2001/XMLSchema-instance"
	xsi:schemaLocation="http://easykit.informatik.tu-muenchen.de/schema/device device.xsd"
	xmlns:dev="http://easykit.informatik.tu-muenchen.de/schema/device"
	xmlns:md="http://easykit.informatik.tu-muenchen.de/schema/model"
	xmlns:plugin="http://easykit.informatik.tu-muenchen.de/schema/plugin"
	xmlns:tr="http://easykit.informatik.tu-muenchen.de/schema/translation"
	xmlns:var="http://easykit.informatik.tu-muenchen.de/schema/variable"
	dev:id="REC GmbH Local Camera" dev:toplevel="true">

	<dev:translations>
	</dev:translations>

	<dev:inputs>
		<dev:input var:type="image" var:varname="image">
			<var:default var:val=""/>
		</dev:input>
	</dev:inputs>

	<dev:outputs>
	</dev:outputs>

	<dev:state>
		<dev:statevar var:type="string" var:varname="log">
			<var:default var:val=""/>
		</dev:statevar>
		<dev:statevar var:type="int16" var:varname="cameraIndex">
			<var:default var:val="0"/>
		</dev:statevar>
	</dev:state>

	<dev:config>
		<dev:configvar var:type="string" var:varname="selectedCamera">
			<var:default var:val=""/>
		</dev:configvar>
		<dev:configvar var:type="int16" var:varname="selectedResolution">
			<var:default var:val="-1"/>
		</dev:configvar>
	</dev:config>

	<dev:provides>
		<dev:resource dev:class="Camera" dev:name="Camera"/>
	</dev:provides>
	<dev:units>
		<dev:unit dev:type="REC GmbH Local Camera" dev:name="Camera">
			<dev:unitRequirements>
				<dev:resource dev:name="Camera"/>
			</dev:unitRequirements>
		</dev:unit>
	</dev:units>

	<!-- Plugin filename -->
	<dev:plugins>
		<dev:plugin plugin:type="simulation" plugin:library="device_localcamera_simulation"/>
		<dev:plugin plugin:type="dialog" plugin:library="device_localcamera_gui"/>
	</dev:plugins>

	<dev:guiinfo>
		<dev:description>
			<dev:name>Local camera</dev:name>
			<dev:detailed>REC GmbH Local Camera</dev:detailed>
			<dev:icon dev:filename="icons/camera.png"/>
		</dev:description>
	</dev:guiinfo>

</dev:device>
