<?xml version="1.0" encoding="UTF-8"?>
<dev:device
	xmlns:xsi="http://www.w3.org/2001/XMLSchema-instance"
	xsi:schemaLocation="http://easykit.informatik.tu-muenchen.de/schema/device device.xsd"
	xmlns:dev="http://easykit.informatik.tu-muenchen.de/schema/device"
	xmlns:md="http://easykit.informatik.tu-muenchen.de/schema/model"
	xmlns:plugin="http://easykit.informatik.tu-muenchen.de/schema/plugin"
	xmlns:tr="http://easykit.informatik.tu-muenchen.de/schema/translation"
	xmlns:var="http://easykit.informatik.tu-muenchen.de/schema/variable"
	dev:id="REC GmbH Data Exchange Server" dev:toplevel="true">

  <dev:translations>
  </dev:translations>

	<dev:inputs>
		<dev:input var:type="int16" var:varname="in0">
			<var:default var:val="0"/>
		</dev:input>
	</dev:inputs>

	<dev:outputs>
		<dev:output var:type="uint32" var:varname="out0">
			<var:default var:val="0"/>
		</dev:output>
	</dev:outputs>

	<dev:state>
	</dev:state>

	<dev:config>
		<dev:configvar var:type="uint16" var:varname="port">
			<var:default var:val="9080"/>
		</dev:configvar>
    <dev:configvar var:type="int32" var:varname="queuedSendingInterval">
      <var:default var:val="200"/>
    </dev:configvar>
	</dev:config>

	<dev:subdevices>
	</dev:subdevices>
	
	<!-- Plugin filename -->
	<dev:plugins>
		<dev:plugin plugin:type="simulation" plugin:library="device_dataexchange_server_simulation"/>
		<dev:plugin plugin:type="dialog" plugin:library="device_dataexchange_server_gui"/>
	</dev:plugins>

  <dev:guiinfo>
    <dev:description>
      <dev:name>Data Exchange Server</dev:name>
      <dev:detailed>REC GmbH Data Exchange Server</dev:detailed>
      <dev:icon dev:filename="icons/server.png"/>
    </dev:description>
  </dev:guiinfo>

</dev:device>
